<?xml version="1.0" encoding="UTF-8"?>
<!ELEMENT channelConfig (context+, categoryProfile+)>
<!ATTLIST channelConfig 
    mappingFile CDATA #REQUIRED>

<!ELEMENT context (description,refCategoryProfile*)>
<!ATTLIST context
    name CDATA #REQUIRED
	id ID #REQUIRED
    edit (all|personal|managed|no) "no">

<!ELEMENT description (#PCDATA)>

<!ELEMENT refCategoryProfile EMPTY>
<!ATTLIST refCategoryProfile 
    refId IDREF #REQUIRED>

<!ELEMENT categoryProfile (description,visibility)>
<!ATTLIST categoryProfile
    id ID #REQUIRED
	name CDATA #REQUIRED
    urlCategory CDATA #REQUIRED
    display (all|push-end|read|not-read) "all"	
    trustCategory (yes|no) "no"
    edit (all|personal|managed|no) "no"
    access (public|cas) "public"
    ttl CDATA #REQUIRED>	
    
<!ELEMENT visibility (allowed,autoSubscribed,obliged)>

<!ELEMENT allowed (regular*, group*)>
<!ELEMENT autoSubscribed (regular*, group*)>
<!ELEMENT obliged (regular*, group*)>

<!ELEMENT regular EMPTY>
<!ATTLIST regular 
    attribute CDATA #REQUIRED
    value CDATA #REQUIRED>

<!ELEMENT group EMPTY>
<!ATTLIST group 
    name CDATA #REQUIRED> 